{
  "version": 1,
  "idempotencyKey": "request-app.update",
  "contextId": "context-1",
  "operation": "app.update",
  "arguments": {
    "card": {
      "version": 1,
      "id": "card-1",
      "scope": {
        "projectId": "project-1",
        "provider": "imessage",
        "accountId": "account-1",
        "lineId": "line-1",
        "spaceId": "space-1"
      },
      "kind": "card",
      "messageId": "message-1"
    },
    "session": {
      "version": 1,
      "id": "session-1",
      "scope": {
        "projectId": "project-1",
        "provider": "imessage",
        "accountId": "account-1",
        "lineId": "line-1",
        "spaceId": "space-1"
      },
      "kind": "card-session",
      "cardId": "card-1"
    },
    "layout": {
      "caption": "update"
    }
  }
}
